{"schema_version":"1.1.0","id":"bfa_itm_01","mode":"single","item_name":"Ashline Tactical Hoodie","item_type":"top","category":"clothing","gender_fit":"unisex","description":"Cropped heavy-cotton pullover hoodie with reinforced elbow panels.","style_axes":{"polish":3,"volume":7,"era":7,"status":4,"function":8,"wear":6},"color_palette":[{"name":"charcoal","hex":"#2B2B2E"}],"material":"heavy brushed cotton","wear_level":"distressed","fivem":{"component_id":11},"image_prompt":"Full-body product shot, charcoal cotton hoodie, oversized sleeves, weathered cuffs, no logos, no text."}
